models/kernels/gfx906_60.cd.updb.txt
9-1080-1920-3x3-32-1080-1920-1-1x1-1x1-1x1-0-NCHW-FP32-F=ConvOclDirectFwd:16,8,16,16,1,2,8,1,1
32-540-960-3x3-64-540-960-1-1x1-1x1-1x1-0-NCHW-FP32-F=ConvOclDirectFwd:16,16,32,32,2,2,8,2,1
64-270-480-3x3-96-270-480-1-1x1-1x1-1x1-0-NCHW-FP32-F=ConvOclDirectFwd:16,16,32,32,2,2,8,4,1
96-135-240-3x3-128-135-240-1-1x1-1x1-1x1-0-NCHW-FP32-F=ConvOclDirectFwd:16,8,16,16,1,2,8,1,1
128-68-120-3x3-160-68-120-1-1x1-1x1-1x1-0-NCHW-FP32-F=ConvOclDirectFwd:16,8,16,16,1,2,8,2,1
160-34-60-3x3-160-34-60-1-1x1-1x1-1x1-0-NCHW-FP32-F=ConvOclDirectFwd:16,16,16,32,1,2,8,4,1
160-68-120-3x3-160-68-120-1-1x1-1x1-1x1-0-NCHW-FP32-F=ConvOclDirectFwd:16,8,16,16,1,2,8,1,1
160-68-120-3x3-128-68-120-1-1x1-1x1-1x1-0-NCHW-FP32-F=ConvOclDirectFwd:16,8,16,32,1,4,8,1,1
128-135-240-3x3-128-135-240-1-1x1-1x1-1x1-0-NCHW-FP32-F=ConvOclDirectFwd:16,8,16,16,1,2,8,2,1
128-135-240-3x3-96-135-240-1-1x1-1x1-1x1-0-NCHW-FP32-F=ConvOclDirectFwd:16,8,16,16,1,2,8,1,1
96-270-480-3x3-96-270-480-1-1x1-1x1-1x1-0-NCHW-FP32-F=ConvOclDirectFwd:16,16,32,32,2,2,8,4,1
96-270-480-3x3-64-270-480-1-1x1-1x1-1x1-0-NCHW-FP32-F=ConvOclDirectFwd:16,16,32,32,2,2,8,2,1
64-540-960-3x3-64-540-960-1-1x1-1x1-1x1-0-NCHW-FP32-F=ConvOclDirectFwd:16,16,32,32,2,2,8,2,1
64-540-960-3x3-32-540-960-1-1x1-1x1-1x1-0-NCHW-FP32-F=ConvOclDirectFwd:16,16,32,32,2,2,8,4,1
32-1080-1920-3x3-32-1080-1920-1-1x1-1x1-1x1-0-NCHW-FP32-F=ConvOclDirectFwd:16,16,32,32,2,2,8,2,1
32-1080-1920-3x3-3-1080-1920-1-1x1-1x1-1x1-0-NCHW-FP32-F=ConvOclDirectFwd:16,16,32,32,2,2,8,2,1
3-1080-1920-3x3-3-1080-1920-1-1x1-1x1-1x1-0-NCHW-FP32-F=ConvOclDirectFwd:16,16,32,32,2,2,8,2,1
9-600-800-3x3-32-600-800-1-1x1-1x1-1x1-0-NCHW-FP32-F=ConvOclDirectFwd:16,16,32,32,2,2,8,1,1
32-300-400-3x3-64-300-400-1-1x1-1x1-1x1-0-NCHW-FP32-F=ConvOclDirectFwd:16,8,16,16,1,2,8,1,1
64-150-200-3x3-96-150-200-1-1x1-1x1-1x1-0-NCHW-FP32-F=ConvOclDirectFwd:16,8,16,16,1,2,8,1,1
96-75-100-3x3-128-75-100-1-1x1-1x1-1x1-0-NCHW-FP32-F=ConvOclDirectFwd:16,8,16,16,1,2,8,1,1
128-38-50-3x3-160-38-50-1-1x1-1x1-1x1-0-NCHW-FP32-F=ConvOclDirectFwd:8,32,16,32,2,1,4,4,1
160-19-25-3x3-160-19-25-1-1x1-1x1-1x1-0-NCHW-FP32-F=ConvOclDirectFwd:8,32,32,32,4,1,1,4,1
160-38-50-3x3-160-38-50-1-1x1-1x1-1x1-0-NCHW-FP32-F=ConvOclDirectFwd:16,16,16,32,1,2,8,4,1
160-38-50-3x3-128-38-50-1-1x1-1x1-1x1-0-NCHW-FP32-F=ConvOclDirectFwd:16,16,16,32,1,2,8,2,1
128-75-100-3x3-128-75-100-1-1x1-1x1-1x1-0-NCHW-FP32-F=ConvOclDirectFwd:16,8,16,16,1,2,8,1,1
128-75-100-3x3-96-75-100-1-1x1-1x1-1x1-0-NCHW-FP32-F=ConvOclDirectFwd:16,8,16,16,1,2,8,1,1
96-150-200-3x3-96-150-200-1-1x1-1x1-1x1-0-NCHW-FP32-F=ConvOclDirectFwd:16,16,32,32,2,2,8,4,1
96-150-200-3x3-64-150-200-1-1x1-1x1-1x1-0-NCHW-FP32-F=ConvOclDirectFwd:16,8,16,16,1,2,8,1,1
64-300-400-3x3-64-300-400-1-1x1-1x1-1x1-0-NCHW-FP32-F=ConvOclDirectFwd:16,8,16,16,1,2,8,1,1
64-300-400-3x3-32-300-400-1-1x1-1x1-1x1-0-NCHW-FP32-F=ConvOclDirectFwd:16,8,16,16,1,2,8,1,1
32-600-800-3x3-32-600-800-1-1x1-1x1-1x1-0-NCHW-FP32-F=ConvOclDirectFwd:16,16,32,32,2,2,8,2,1
32-600-800-3x3-3-600-800-1-1x1-1x1-1x1-0-NCHW-FP32-F=ConvOclDirectFwd:16,16,32,32,2,2,8,2,1
3-600-800-3x3-3-600-800-1-1x1-1x1-1x1-0-NCHW-FP32-F=ConvOclDirectFwd:16,16,32,32,2,2,8,2,1
3-600-800-3x3-32-600-800-1-1x1-1x1-1x1-0-NCHW-FP32-F=ConvOclDirectFwd:16,8,16,16,1,2,8,1,1
3-1080-1920-3x3-32-1080-1920-1-1x1-1x1-1x1-0-NCHW-FP32-F=ConvOclDirectFwd:8,16,16,32,2,2,8,1,1
