models/kernels/gfx902_8.cd.updb.txt
9-600-800-3x3-32-600-800-1-1x1-1x1-1x1-0-NCHW-FP32-F=ConvOclDirectFwd:16,8,16,16,1,2,8,1,1
32-300-400-3x3-64-300-400-1-1x1-1x1-1x1-0-NCHW-FP32-F=ConvOclDirectFwd:16,16,32,32,2,2,8,4,1
64-150-200-3x3-96-150-200-1-1x1-1x1-1x1-0-NCHW-FP32-F=ConvOclDirectFwd:16,16,32,32,2,2,8,2,1
96-75-100-3x3-128-75-100-1-1x1-1x1-1x1-0-NCHW-FP32-F=ConvOclDirectFwd:8,8,16,16,2,2,8,2,1
128-38-50-3x3-160-38-50-1-1x1-1x1-1x1-0-NCHW-FP32-F=ConvOclDirectFwd:8,8,16,16,2,2,8,2,1
160-19-25-3x3-160-19-25-1-1x1-1x1-1x1-0-NCHW-FP32-F=ConvOclDirectFwd:16,16,32,32,2,2,8,2,1
160-38-50-3x3-160-38-50-1-1x1-1x1-1x1-0-NCHW-FP32-F=ConvOclDirectFwd:16,16,32,32,2,2,8,2,1
160-38-50-3x3-128-38-50-1-1x1-1x1-1x1-0-NCHW-FP32-F=ConvOclDirectFwd:8,16,16,16,2,1,8,2,1
128-75-100-3x3-128-75-100-1-1x1-1x1-1x1-0-NCHW-FP32-F=ConvOclDirectFwd:16,8,16,16,1,2,8,2,1
128-75-100-3x3-96-75-100-1-1x1-1x1-1x1-0-NCHW-FP32-F=ConvOclDirectFwd:8,16,16,32,2,2,8,2,1
96-150-200-3x3-96-150-200-1-1x1-1x1-1x1-0-NCHW-FP32-F=ConvOclDirectFwd:16,16,32,32,2,2,8,2,1
96-150-200-3x3-64-150-200-1-1x1-1x1-1x1-0-NCHW-FP32-F=ConvOclDirectFwd:16,16,32,32,2,2,8,2,1
64-300-400-3x3-64-300-400-1-1x1-1x1-1x1-0-NCHW-FP32-F=ConvOclDirectFwd:16,16,32,32,2,2,8,2,1
64-300-400-3x3-32-300-400-1-1x1-1x1-1x1-0-NCHW-FP32-F=ConvOclDirectFwd:16,16,32,32,2,2,8,2,1
32-600-800-3x3-32-600-800-1-1x1-1x1-1x1-0-NCHW-FP32-F=ConvOclDirectFwd:16,16,32,32,2,2,8,2,1
32-600-800-3x3-3-600-800-1-1x1-1x1-1x1-0-NCHW-FP32-F=ConvOclDirectFwd:16,16,32,32,2,2,8,2,1
3-600-800-3x3-3-600-800-1-1x1-1x1-1x1-0-NCHW-FP32-F=ConvOclDirectFwd:8,16,16,32,2,2,2,1,1
